{
  "scenario": "gate_system_happy",
  "description": "Minimal flow exercising gate_step + system_step actors. Provider step writes a stub note, gate auto-approves via fixture, close_finalize writes a closed marker, engine reaches success terminal.",
  "starting_node": "do_work",
  "flow_id": "pdh-test-gate-system",
  "variant": "full",
  "expected_decisions": [
    { "node": "review_gate", "round": 1, "decision": "approved" }
  ],
  "expected_terminal_node": "success",
  "expected_commits": [
    { "subject_pattern": "^\\[do_work/round-1\\] " }
  ],
  "node_outputs": {
    "do_work": {
      "round-1": {
        "summary": "stub work for gate+system test",
        "note_section": "## do_work (round 1)\n\nDid the work; ready for gate.\n"
      }
    }
  },
  "gate_decisions": {
    "review_gate": {
      "status": "completed",
      "node_id": "review_gate",
      "decision": "approved",
      "approver": "test-fixture-pdm",
      "decided_at": "2026-05-08T00:00:00Z",
      "comment": "auto-approved by fixture",
      "via": "api"
    }
  }
}
